ID,Category,Question,Answer1,Answer2,Answer3,Answer4,Answer5,Answer6,Answer7,Answer8,Answer9,Answer10,CorrectAns1,CorrectAns2,CorrectAns3
372,PRODUCTION & DELIVERY,What means FMS ? ,Force Manual System,Fire Management System,Finish Measuring Stable,Final Mix Strained,NIL,NIL,NIL,NIL,NIL,NIL,Final Mix Strained,NIL,NIL
373,PRODUCTION & DELIVERY,What means TS4?,A mold number,A bladder type,Dot week,Type of press,NIL,NIL,NIL,NIL,NIL,NIL,A bladder type,NIL,NIL
374,PRODUCTION & DELIVERY,Week dot plate means:,Date of mold mounted,Date of mounted bladder,Production date of a cured tire,Shift date,NIL,NIL,NIL,NIL,NIL,NIL,Production date of a cured tire,NIL,NIL
375,PRODUCTION & DELIVERY,What is the name of the mobile scanner used in curing?,MC55,MF55,MX55,MT55,NIL,NIL,NIL,NIL,NIL,NIL,MC55,NIL,NIL
376,PRODUCTION & DELIVERY,What is the name for TWI?,Tire weight indicator,Total waste indicator,Type Work Instruction,Tread Wear Indicator,NIL,NIL,NIL,NIL,NIL,NIL,Tread Wear Indicator,NIL,NIL
377,PRODUCTION & DELIVERY,In order to clean a mold it is necessary to use:,Water,Cleaning substance for window,Ice,Air pressure ,NIL,NIL,NIL,NIL,NIL,NIL,Ice,NIL,NIL
378,PRODUCTION & DELIVERY,What means MGTS?,Multi green tire system,Many green tires sold,Multi green tire stand,Monitor green tire solution,NIL,NIL,NIL,NIL,NIL,NIL,Multi green tire stand,NIL,NIL
379,PRODUCTION & DELIVERY,Main scrap faults from curing begins with,3~,6~,2~,5~,NIL,NIL,NIL,NIL,NIL,NIL,6~,NIL,NIL
380,PRODUCTION & DELIVERY,What is the number of scrap code for dirt mold?,68A,66B,6C,60,NIL,NIL,NIL,NIL,NIL,NIL,68A,NIL,NIL
381,PRODUCTION & DELIVERY,What is the name of mandatory procedure in order to release a mold in production?,Mold change,Mold assembly,Mold release,There is no procedure needed,NIL,NIL,NIL,NIL,NIL,NIL,Mold release,NIL,NIL
382,PRODUCTION & DELIVERY,What is the name of the error proofing device in curing?,PT1,PT10,No error proofing device,PT100,NIL,NIL,NIL,NIL,NIL,NIL,PT100,NIL,NIL
383,PRODUCTION & DELIVERY,Who should decide in case of energy breakdown about affected tires?,Operator,Shift leader,Quality,341 team,NIL,NIL,NIL,NIL,NIL,NIL,341 team,NIL,NIL
384,PRODUCTION & DELIVERY,What are the conditions to keep bladders storage?,"Covered with black foil, hidden from sun light",Hidden from sun light but not covered ,Exposed to sun light and not covered,No special conditions,NIL,NIL,NIL,NIL,NIL,NIL,"Covered with black foil, hidden from sun light",NIL,NIL
385,PRODUCTION & DELIVERY,What means R from 225/55/R17,Red color code,Rim protection,Radial,Ready to use,NIL,NIL,NIL,NIL,NIL,NIL,Radial,NIL,NIL
386,PRODUCTION & DELIVERY,Which type of tires are using stud pins?,Summer tires,Winter tires,Both seasons,Tires are not using stud pins,NIL,NIL,NIL,NIL,NIL,NIL,Winter tires,NIL,NIL
387,PRODUCTION & DELIVERY,What does QDA stand for ,Quality  Data Analyze ,Quick  done  act ,Question data analyze ,Quick done analyze ,NIL,NIL,NIL,NIL,NIL,NIL,Quality  Data Analyze ,NIL,NIL
388,PRODUCTION & DELIVERY,What is  part Traceability?,Ability to trace a part back to the manufacturing conditions that built it,Ability to find a part years after it is shipped,Ability to locate a part via GPS,Ability to run diagnostics on a part in the field,NIL,NIL,NIL,NIL,NIL,NIL,Ability to trace a part back to the manufacturing conditions that built it,NIL,NIL
389,PRODUCTION & DELIVERY,What does RPN acronym mean?,Risk Priority Number,Risk Production Number,Relation Priority Number,Risk Product Name,NIL,NIL,NIL,NIL,NIL,NIL,Risk Priority Number,NIL,NIL
390,PRODUCTION & DELIVERY,FMEA means ?,Failure mode effects analysis,Business model,Financial estimation measure accounting,Problem solving technique,NIL,NIL,NIL,NIL,NIL,NIL,Failure mode effects analysis,NIL,NIL
391,PRODUCTION & DELIVERY,What is the Triscan for ,Measuring  the color code  of the product ,Measuring the geometry  of the product ,Measuring the parameters of the product ,Measuring the angle  of the product ,NIL,NIL,NIL,NIL,NIL,NIL,Measuring the geometry  of the product ,NIL,NIL
392,PRODUCTION & DELIVERY,When a process is considered as capable?,When Cpk is higher than 1,When Cpk is lower than 1,When Cpk is higher than 1.33,None of the  them ,NIL,NIL,NIL,NIL,NIL,NIL,When Cpk is higher than 1.33,NIL,NIL
393,PRODUCTION & DELIVERY,What means FE-FO ,"First expired ,first out ","First  inn ,last  out ",Last in ; last out ,None of the  them ,NIL,NIL,NIL,NIL,NIL,NIL,"First expired ,first out ",NIL,NIL
394,PRODUCTION & DELIVERY,What is not part of the “5S”?,Standardize,Sustain,Stay,Shine,NIL,NIL,NIL,NIL,NIL,NIL,Stay,NIL,NIL
395,PRODUCTION & DELIVERY,What means SW ,Stay and wait ,Sidewall ,Standardize work,Standing  with ,NIL,NIL,NIL,NIL,NIL,NIL,---,NIL,NIL
396,PRODUCTION & DELIVERY,Which of these steps is necessary when implementing quality management?,Quality control,Quality measurement,Quality quantification,Quality definition,NIL,NIL,NIL,NIL,NIL,NIL,Quality control,NIL,NIL
397,PRODUCTION & DELIVERY,What material is produce on the Trilpex line ,Bead ,Breaker ,Tread,Textile ,NIL,NIL,NIL,NIL,NIL,NIL,Tread,NIL,NIL
398,PRODUCTION & DELIVERY,From what word is coming the letter H from H8111,Hydraulic,Halobutyl,Hook ,Hot ,NIL,NIL,NIL,NIL,NIL,NIL,Halobutyl,NIL,NIL
399,PRODUCTION & DELIVERY,The abbreviation “ppm” means:,Parts per million,Parts per minute,Proactive power management,Personal program manager,NIL,NIL,NIL,NIL,NIL,NIL,Parts per million,NIL,NIL
400,PRODUCTION & DELIVERY,"What does ""SOP"" mean?",Standard operation process,Supervisor of production,Start of production,Safety operations program,NIL,NIL,NIL,NIL,NIL,NIL,Start of production,NIL,NIL
401,PRODUCTION & DELIVERY,What means TCU ,Treat control unit,Temperature control unit ,Team control ,Treatment  control ,NIL,NIL,NIL,NIL,NIL,NIL,---,NIL,NIL
402,PRODUCTION & DELIVERY,What measure a TU machine on a tire?,Imbalance,Uniformity,Geometry,Visual aspect,NIL,NIL,NIL,NIL,NIL,NIL,Uniformity,NIL,NIL
403,PRODUCTION & DELIVERY,What measure a TG machine on a tire?,Imbalance,Uniformity,Geometry,Visual aspect,NIL,NIL,NIL,NIL,NIL,NIL,Geometry,NIL,NIL
404,PRODUCTION & DELIVERY,What measure a TB machine on a tire?,Imbalance,Uniformity,Geometry,Visual aspect,NIL,NIL,NIL,NIL,NIL,NIL,Imbalance,NIL,NIL
405,PRODUCTION & DELIVERY,Conductive yarn is used in ?,All silica tires,Agro tires,CVT tires,None of these,NIL,NIL,NIL,NIL,NIL,NIL,All silica tires,NIL,NIL
406,PRODUCTION & DELIVERY,Full form of PFMEA is ?,Potential Failure Mode Effect Analysis,Product Failure Mode Effect Analysis,Process Failure Mode Effect Analysis,None of these,NIL,NIL,NIL,NIL,NIL,NIL,Potential Failure Mode Effect Analysis,NIL,NIL
407,PRODUCTION & DELIVERY,Green tire is ?,Eco friendly tire,Uncured tire,Zero Carbon tire,None of these,NIL,NIL,NIL,NIL,NIL,NIL,Uncured tire,NIL,NIL
408,PRODUCTION & DELIVERY,Identification and Traceability is important requirement to meet ?,OE customer requirements,Legal Requirements,Continental Business requirements,All of these,NIL,NIL,NIL,NIL,NIL,NIL,All of these,NIL,NIL
409,PRODUCTION & DELIVERY,In mixing process the compound properties are affected by ?,Rotor RPM,Ram Pressure,Mixing Time,All of these,NIL,NIL,NIL,NIL,NIL,NIL,All of these,NIL,NIL
410,PRODUCTION & DELIVERY,Color of a Vulcanized Tire is  ?,Always Black,Green Color,Can be of any color,Yellow color,NIL,NIL,NIL,NIL,NIL,NIL,Can be of any color,NIL,NIL
411,PRODUCTION & DELIVERY,Shape of tire is generally ?,Toroidal,Circular,Spherical,Conical,NIL,NIL,NIL,NIL,NIL,NIL,Toroidal,NIL,NIL
412,PRODUCTION & DELIVERY,Polymer used for tire manufacturing is ?,Natural Rubber,Synthetic Rubber,Reclaim Rubber,All of these,NIL,NIL,NIL,NIL,NIL,NIL,All of these,NIL,NIL
413,PRODUCTION & DELIVERY,Source of Natural Rubber is ?,Milk from Rubber Tree,Leaves of Rubber Tree,Bark of Rubber Tree,All of these,NIL,NIL,NIL,NIL,NIL,NIL,Milk from Rubber Tree,NIL,NIL
414,PRODUCTION & DELIVERY,Tire manufacturing process which is similar to pressing of a tooth paste tube is ?,Mixing,Extrusion,Calendaring,Green Tire building,NIL,NIL,NIL,NIL,NIL,NIL,Extrusion,NIL,NIL
415,PRODUCTION & DELIVERY,"Green Tire components like Sidewall, Tread or Bead must be stored on ?",Wooden Pallets,Plastic Pallets,Steel Pallets,Any of these,NIL,NIL,NIL,NIL,NIL,NIL,Steel Pallets,NIL,NIL
416,PRODUCTION & DELIVERY,Which of these is a rubber compound property ?,Rebound,Contamination,X-ray,None of these,NIL,NIL,NIL,NIL,NIL,NIL,Rebound,NIL,NIL
417,PRODUCTION & DELIVERY,Purpose of Raw material Sulphur in Tire manufacturing is ?,Anti Oxidant,Solvent,Vulcanizing Agent,Reinforcing Agent,NIL,NIL,NIL,NIL,NIL,NIL,Vulcanizing Agent,NIL,NIL
418,PRODUCTION & DELIVERY,How many guiding principles are their in our Global Quality Policy Understanding ?,4,5,6,8,NIL,NIL,NIL,NIL,NIL,NIL,5,NIL,NIL
419,PRODUCTION & DELIVERY,The guiding principle(s) that express our understanding of quality is ?,Customer satisfaction,Together,Structured,All of these,NIL,NIL,NIL,NIL,NIL,NIL,All of these,NIL,NIL
420,PRODUCTION & DELIVERY,"The guiding principle fits for "" Of course, quality must be considered in context together with other success factors such as cost, speed, and innovations"" is ?",Customer satisfaction,Together,Structured,Holistic,NIL,NIL,NIL,NIL,NIL,NIL,Holistic,NIL,NIL
421,PRODUCTION & DELIVERY,"This statement "" The future starts earlier with Continental "" best fits in Continental Corporation's ?",Mission,Vision,Values,None of these,NIL,NIL,NIL,NIL,NIL,NIL,Mission,NIL,NIL
422,PRODUCTION & DELIVERY,When was Continental founded ?,"October 8, 1918","October 8, 1781","October 8, 1871","October 8, 1971",NIL,NIL,NIL,NIL,NIL,NIL,"October 8, 1871",NIL,NIL
423,PRODUCTION & DELIVERY,"Your Mobility. Your Freedom. Our Signature, this best fits with Continental Corporation's ?",Mission,Vision,Values,None of these,NIL,NIL,NIL,NIL,NIL,NIL,Vision,NIL,NIL
424,PRODUCTION & DELIVERY,What is OoY?,Origin of Year,Out of Yarn,Out of Yield,"None of these( a,b&c)",NIL,NIL,NIL,NIL,NIL,NIL,Out of Yield,NIL,NIL
425,PRODUCTION & DELIVERY, What does RDC mean?,Regional Distribution Center,Radial Direction Control,Radial Development Center,Regional Development Center,NIL,NIL,NIL,NIL,NIL,NIL,Regional Distribution Center,NIL,NIL
426,PRODUCTION & DELIVERY, What does WAMOS means?,Warehouse Management and Optimization System ,Warehouse Management and Operation System,Warehouse Method and Optimization System,Warehouse Method and Operation system,NIL,NIL,NIL,NIL,NIL,NIL,Warehouse Management and Optimization System ,NIL,NIL
427,PRODUCTION & DELIVERY,What does ECE  means?,Economic Commission for Europe,Economic Committee for Europe,Energy Commission for Europe,Efficient Commission for Europe,NIL,NIL,NIL,NIL,NIL,NIL,Economic Commission for Europe,NIL,NIL
428,PRODUCTION & DELIVERY, What does E.T.R.T.O means?,European Tire and Rim Trade Organization,Economic Tire and Rim Trade Organization,Economic Tire and Rim Technical organization,European Tire and Rim Technical Organization,NIL,NIL,NIL,NIL,NIL,NIL,European Tire and Rim Technical Organization,NIL,NIL
429,PRODUCTION & DELIVERY, What does DOT Stands for?,Development Of Tire,Department of Transportation,Division Of Tire,Direction of Tire,NIL,NIL,NIL,NIL,NIL,NIL,Department of Transportation,NIL,NIL
430,PRODUCTION & DELIVERY, What does MES means?,Machine Equipment Standard,Machine Engineering Standard,Machine equipment specification,Machine Engineering Specification,NIL,NIL,NIL,NIL,NIL,NIL,Machine Equipment Standard,NIL,NIL
431,PRODUCTION & DELIVERY,What does PPS Audit mean?,Planned Process System Audit,Production Planning Sequence Audit,Process Product System Audit,Summary Audit,NIL,NIL,NIL,NIL,NIL,NIL,Process Product System Audit,NIL,NIL
432,PRODUCTION & DELIVERY,What is mean by TWI?,Tread wear indicator,Tire Wear Indicator,Tire Warranty Indicator,Total Weight Indicator,NIL,NIL,NIL,NIL,NIL,NIL,Tread wear indicator,NIL,NIL
433,PRODUCTION & DELIVERY, What is the minimum TWI height?,1.6mm ,2.0mm,2.5mm,1.9 mm,NIL,NIL,NIL,NIL,NIL,NIL,1.6mm ,NIL,NIL
434,PRODUCTION & DELIVERY,How many Tread Wear Indicator Marking in a Tire?,5,6,7,2,NIL,NIL,NIL,NIL,NIL,NIL,6,NIL,NIL
435,PRODUCTION & DELIVERY,What does MRC means?,Market Readiness Check,Machine Radius Check,Market Road Check,Machine Readiness Check,NIL,NIL,NIL,NIL,NIL,NIL,Market Readiness Check,NIL,NIL
436,PRODUCTION & DELIVERY, What does TTT means?,Tire Tracking Tool,Tire Tube Tool,Tire Tube Tracking,Total Tire Tracking,NIL,NIL,NIL,NIL,NIL,NIL,Tire Tracking Tool,NIL,NIL
437,PRODUCTION & DELIVERY,What is the effect of Missing or uneven carcass cords in the sidewall ?,Bulge,Conicity,Imbalance,Lateral force,NIL,NIL,NIL,NIL,NIL,NIL,Bulge,NIL,NIL
438,PRODUCTION & DELIVERY,What does “UER” stand for?,Unwinding Error,Unloading Error,Utilized Equipment Report,User Error,NIL,NIL,NIL,NIL,NIL,NIL,Unloading Error,NIL,NIL
439,PRODUCTION & DELIVERY,"What does ""FEFO"" stand for?",First In First Out,First Input First Output,First Production First Consuming,First expiration First out,NIL,NIL,NIL,NIL,NIL,NIL,First expiration First out,NIL,NIL
440,PRODUCTION & DELIVERY,What's the release criteria for normal final mixing compound?,Size,Weight per square meter,Linear weight,Rheo and Moony result,NIL,NIL,NIL,NIL,NIL,NIL,Rheo and Moony result,NIL,NIL
441,PRODUCTION & DELIVERY,"What does ""SOP"" stand for?",Start of Production,Serial of Production,Standard of Production,Standard Operation Procedure,NIL,NIL,NIL,NIL,NIL,NIL,Serial of Production,NIL,NIL
442,PRODUCTION & DELIVERY,What is MMOG?,Materials Management Operations Guideline,Materials Measuring Operations Guideline,Material logistic evaluation system,Massive multiplayer Online Game,NIL,NIL,NIL,NIL,NIL,NIL,Materials Management Operations Guideline,NIL,NIL
443,PRODUCTION & DELIVERY,What's the KPI meaning of PPM ?,Parts Per Million,Pages Per Minute,Project Portfolio Management,Production Problem Monitor,NIL,NIL,NIL,NIL,NIL,NIL,Parts Per Million,NIL,NIL
444,PRODUCTION & DELIVERY,Which one is not included in the 8 wastes?,Production,Defects,Over Process,Inventory,NIL,NIL,NIL,NIL,NIL,NIL,Production,NIL,NIL
445,PRODUCTION & DELIVERY,"What does ""SMED"" stand for ?",Single Minute Exchange of Dies  ,Speed mold exchange device,Smooth mold Exchange of Die,Single Mold Exchange of Die,NIL,NIL,NIL,NIL,NIL,NIL,Single Minute Exchange of Dies  ,NIL,NIL
446,PRODUCTION & DELIVERY,What's WIP?,Waiting in process,Work in Process,Work in Product,What in Progress,NIL,NIL,NIL,NIL,NIL,NIL,Work in Process,NIL,NIL
447,PRODUCTION & DELIVERY,Carbon black and silica are used for tire compound production. Silica's color is____,White,Black,Yellow,Green,NIL,NIL,NIL,NIL,NIL,NIL,White,NIL,NIL
448,PRODUCTION & DELIVERY,Which is not the purpose to assure FIFO?,Assure good quality,Avoiding expiring material and product,Avoiding waste,Reduce inventory,NIL,NIL,NIL,NIL,NIL,NIL,Reduce inventory,NIL,NIL
449,PRODUCTION & DELIVERY,What is CIM?,Center Idea management,Continental Idea Management,Continental Idea Method,Continental ideal monitor,NIL,NIL,NIL,NIL,NIL,NIL,Continental Idea Management,NIL,NIL
450,PRODUCTION & DELIVERY,What's unofficial OE complaint?,Complaint from Tire Wheel Assembly,Complaint from OEM,Complaint from tire user,Complaint from retailer,NIL,NIL,NIL,NIL,NIL,NIL,Complaint from Tire Wheel Assembly,NIL,NIL
451,PRODUCTION & DELIVERY,What is official OE Complaint,Complaint from Tire Wheel Assembly,Complaint from OEM,Complaint from tire user,Complaint from retailer,NIL,NIL,NIL,NIL,NIL,NIL,Complaint from OEM,NIL,NIL
452,PRODUCTION & DELIVERY,What does “RPN” stand for?,Risk premium,Risk Priority Number,Repeat problem Number,Reduce problem Number,NIL,NIL,NIL,NIL,NIL,NIL,Risk Priority Number,NIL,NIL
453,PRODUCTION & DELIVERY,"What does ""CCC"" stand for?",OE customer required,China Compulsory Certification,China Customer required,Console Control Circuits,NIL,NIL,NIL,NIL,NIL,NIL,China Compulsory Certification,NIL,NIL
454,PRODUCTION & DELIVERY,What is CPK?,Combined Public Key,Control plan ,Complex Process Capability Index,Continues problem solving,NIL,NIL,NIL,NIL,NIL,NIL,Complex Process Capability Index,NIL,NIL
455,PRODUCTION & DELIVERY,What is the Machine Cmk?,Consumer and Market Knowledge,Capacity of machine knowledge,Machine Capability Index,Combined Public Key,NIL,NIL,NIL,NIL,NIL,NIL,Machine Capability Index,NIL,NIL
456,PRODUCTION & DELIVERY,Which of the CBS tool is to achieve prevention?,Visual Management,Problem Solving,Poka yoke,Standard Work,NIL,NIL,NIL,NIL,NIL,NIL,Poka yoke,NIL,NIL
457,PRODUCTION & DELIVERY,What's the influence of nonconforming product out to the customer?,Customer complaint,Safety risk,Loss of customer,All can be,NIL,NIL,NIL,NIL,NIL,NIL,All can be,NIL,NIL
458,PRODUCTION & DELIVERY,What is the normal OEM requirement of Ppk in PPAP phase,>1.67,1.33,>1.33,1.67,NIL,NIL,NIL,NIL,NIL,NIL,>1.67,NIL,NIL
459,PRODUCTION & DELIVERY,Which is NOT the KPI to measure delivery performance?,Internal Delivery Errors,External Delivery Errors,Quality Error,Scrap,NIL,NIL,NIL,NIL,NIL,NIL,Scrap,NIL,NIL
460,PRODUCTION & DELIVERY,When have we to do First Piece Check or First Article Inspection?,Each shift process change,Material change,Tooling change,All of them,NIL,NIL,NIL,NIL,NIL,NIL,All of them,NIL,NIL
461,PRODUCTION & DELIVERY,What is WDK?,Widget Development Kit ,Windows Driver Kit,Web Development Kit,German Rubber Manufactures' Association,NIL,NIL,NIL,NIL,NIL,NIL,German Rubber Manufactures' Association,NIL,NIL
462,PRODUCTION & DELIVERY,What kind of actions is good when an operator detect nonconforming products?,Report to supervisor,Separate the nonconforming products,Label the nonconforming products,All of them,NIL,NIL,NIL,NIL,NIL,NIL,All of them,NIL,NIL
463,PRODUCTION & DELIVERY,What is SFI?,Shop floor ideas,Selling Fresh Ideas,Shop Floor Integration,Sequential Fuel Injection,NIL,NIL,NIL,NIL,NIL,NIL,Shop Floor Integration,NIL,NIL
464,PRODUCTION & DELIVERY,What is MVTS?,Material traceability System,Material Validation & Traceability Solution,Motion and Transportation Solution,Manufacturing verification System,NIL,NIL,NIL,NIL,NIL,NIL,Material Validation & Traceability Solution,NIL,NIL
465,PRODUCTION & DELIVERY,What is DOT ?,Damage over time,US Department of Transportation,DO it,Date of tire building,NIL,NIL,NIL,NIL,NIL,NIL,US Department of Transportation,NIL,NIL
466,PRODUCTION & DELIVERY,"If I bought one tire from market, how can I check the traceability of the tire?",Barcode,Work Week,Plant,DOT,NIL,NIL,NIL,NIL,NIL,NIL,Barcode,NIL,NIL
467,PRODUCTION & DELIVERY,Shelf life for textile reinforcement material is____,1 month,6 months,2 years,10 years,NIL,NIL,NIL,NIL,NIL,NIL,6 months,NIL,NIL
468,PRODUCTION & DELIVERY,What's QSB?,Quality system basics,Quality supplier basics,Quotation system basics,Qualified Suppliers basics,NIL,NIL,NIL,NIL,NIL,NIL,Quality system basics,NIL,NIL
469,PRODUCTION & DELIVERY,What is the main quality control point for calendaring product?,Thickness,Weight,Density,All of them,NIL,NIL,NIL,NIL,NIL,NIL,All of them,NIL,NIL
470,PRODUCTION & DELIVERY,Which one is not belong to QSB,Fast Response,MMOG,Managing Change,Layered Process Audits,NIL,NIL,NIL,NIL,NIL,NIL,MMOG,NIL,NIL
471,PRODUCTION & DELIVERY,LPA is,List of problem and actions,Link pack area ,Lean Production audit,Layered Process Audits,NIL,NIL,NIL,NIL,NIL,NIL,Layered Process Audits,NIL,NIL
472,PRODUCTION & DELIVERY,What is CAT tool,OE complaint Administration tracking,Continental administration tool,Complaint analysis tool,Customer administration tool,NIL,NIL,NIL,NIL,NIL,NIL,OE complaint Administration tracking,NIL,NIL
473,PRODUCTION & DELIVERY,What will impact OEE?,Downtime loss,Speed loss,Quality loss,All of them,NIL,NIL,NIL,NIL,NIL,NIL,All of them,NIL,NIL
474,PRODUCTION & DELIVERY,"What does"" OEE"" stand for?",Official equipment efficiency,Overall equipment efficiency,Office of experiential Education,Overall experiential Education,NIL,NIL,NIL,NIL,NIL,NIL,Overall equipment efficiency,NIL,NIL
475,PRODUCTION & DELIVERY,What is not part of the 5S?,Standardize,Sort,Shine,Schedule,NIL,NIL,NIL,NIL,NIL,NIL,Schedule,NIL,NIL
476,PRODUCTION & DELIVERY,Which one is similar to GP12,Safe Launch,Grading,Visual appearance inspection,Incoming checking,NIL,NIL,NIL,NIL,NIL,NIL,Safe Launch,NIL,NIL
477,PRODUCTION & DELIVERY,How to Quit GP12 procedure ?,Approved by Quality manager,Approved by Center QM,Approved by Plant  Manager,Approved by OE customer,NIL,NIL,NIL,NIL,NIL,NIL,Approved by OE customer,NIL,NIL
478,PRODUCTION & DELIVERY,what is QDA,Qualitative Data Analysis,Quality data analysis,Quality deviation analysis,Quality database authority,NIL,NIL,NIL,NIL,NIL,NIL,Quality data analysis,NIL,NIL
479,PRODUCTION & DELIVERY,“Jidoka” is:,Asian software system,Intelligent automation,Continental branch in Asia,Martial arts technique,NIL,NIL,NIL,NIL,NIL,NIL,Intelligent automation,NIL,NIL
480,PRODUCTION & DELIVERY,JIT is,Job instruction training,Just-in-time,Just in tolerance,Just Do it,NIL,NIL,NIL,NIL,NIL,NIL,Just-in-time,NIL,NIL
481,PRODUCTION & DELIVERY,What is the KPI to measure delivery performance?,Scrap VI,On time delivery,OE Warehouse Yield,SOP in time,NIL,NIL,NIL,NIL,NIL,NIL,On time delivery,NIL,NIL
482,PRODUCTION & DELIVERY,Which of the KPI is defined to measure Warehouse/ Delivery performance?,Over age tires,Quality errors(Internal and External),Damage/deformation/dirtiness,All of them,NIL,NIL,NIL,NIL,NIL,NIL,All of them,NIL,NIL
483,PRODUCTION & DELIVERY,Which scrap is belong to Scrap I?,Compound,Components after rubbered,Carcass and Green Tires,Cured Tires,NIL,NIL,NIL,NIL,NIL,NIL,Compound,NIL,NIL
484,PRODUCTION & DELIVERY,Which scrap is belong to Scrap II?,Compound,Components after rubbered,Carcass and Green Tires,Cured Tires,NIL,NIL,NIL,NIL,NIL,NIL,Components after rubbered,NIL,NIL
485,PRODUCTION & DELIVERY,Which scrap is belong to Scrap III?,Compound,Components after rubbered,Carcass and Green Tires,Cured Tires,NIL,NIL,NIL,NIL,NIL,NIL,Carcass and Green Tires,NIL,NIL
486,PRODUCTION & DELIVERY,Which scrap is belong to Scrap IV?,Compound,Components after rubbered,Carcass and Green Tires,Cured Tires,NIL,NIL,NIL,NIL,NIL,NIL,Cured Tires,NIL,NIL
487,PRODUCTION & DELIVERY,What is the main quality control point for tread and sidewall?,Width,Thickness,Compound interface dimension,All of them,NIL,NIL,NIL,NIL,NIL,NIL,All of them,NIL,NIL
488,PRODUCTION & DELIVERY,What is the name of the Product Release Process in tires?,RN,AP,TT,TA,NIL,NIL,NIL,NIL,NIL,NIL,RN,NIL,NIL
489,PRODUCTION & DELIVERY,What is an example of Jidoka stop limit in the plant?,90% OEE,3 consecutive defectives within 2 hours,5% scrap rate,96% FPY,NIL,NIL,NIL,NIL,NIL,NIL,3 consecutive defectives within 2 hours,NIL,NIL
490,PRODUCTION & DELIVERY,Which function may not be included in Jidoka team?,Production,Quality,Industrial Engineering,Finance,NIL,NIL,NIL,NIL,NIL,NIL,Finance,NIL,NIL
491,PRODUCTION & DELIVERY,What means MSA?,"Measure, secure, activate",Manufacturing System Analyze,Middle statistical average,Measurement System Analysis,NIL,NIL,NIL,NIL,NIL,NIL,Measurement System Analysis,NIL,NIL
492,PRODUCTION & DELIVERY,What is a KPI dashboard?,A poster from QM,A table from industrial engineering,An overview of all Key Performance Indicator,Key Product Indicator,NIL,NIL,NIL,NIL,NIL,NIL,An overview of all Key Performance Indicator,NIL,NIL
493,PRODUCTION & DELIVERY,How is a process defined?,"Activity with In- and Output, Supplier, Customer",Activity within on department,Department is the same like a process,Process is more than one department,NIL,NIL,NIL,NIL,NIL,NIL,"Activity with In- and Output, Supplier, Customer",NIL,NIL
494,PRODUCTION & DELIVERY,What is fifo?,Fill in fill out,First in for ordering,First in first out,Safe Process Control,NIL,NIL,NIL,NIL,NIL,NIL,First in first out,NIL,NIL
495,PRODUCTION & DELIVERY,What is filo?,First loop,First in last out,Final loop,A Intranet page,NIL,NIL,NIL,NIL,NIL,NIL,First in last out,NIL,NIL
496,PRODUCTION & DELIVERY,What is PI?,Process indicator,Production indicator,Process improvement,Process investment,NIL,NIL,NIL,NIL,NIL,NIL,Process indicator,NIL,NIL
497,PRODUCTION & DELIVERY,Who is responsible for the KPI,Main department leader,Process Owner,Everybody,Group leader,NIL,NIL,NIL,NIL,NIL,NIL,Process Owner,NIL,NIL
498,PRODUCTION & DELIVERY,What is the JIDOKA target?,Less quality incidents ,Set up lean structure and environment,Standardize operators work,Reduce cost and meet business goals,NIL,NIL,NIL,NIL,NIL,NIL,Less quality incidents ,NIL,NIL
499,PRODUCTION & DELIVERY,Who is responsible for JIDOKA implementation and sustainability in the plant ?,Central IE,Production team ,Head of quality management plant,New Product Launch Manager,NIL,NIL,NIL,NIL,NIL,NIL,Head of quality management plant,NIL,NIL
500,PRODUCTION & DELIVERY,Which one does not belong to the JIDOKA  6 key steps?,Detect a deviation,Stop the process,Compare with limit,Start Lean dialogue,NIL,NIL,NIL,NIL,NIL,NIL,Start Lean dialogue,NIL,NIL
501,PRODUCTION & DELIVERY,"Which company firstly invented ""Jidoka"" tool?",America GM,Japan Toyota,German VW,China Chery,NIL,NIL,NIL,NIL,NIL,NIL,Japan Toyota,NIL,NIL
502,PRODUCTION & DELIVERY,What's the correct sequence of Jidoka process flow?,Watch the process?detect a deviation?compare with limit?stop the process?correct the deviation?restart the process,Watch the process?compare with limit?detect a deviation?stop the process?correct the deviation?restart the process,Watch the process?detect a deviation?compare with limit?stop the process?restart the process?correct the deviation,Compare with limit?detect a deviation?watch the process?stop the process?correct the deviation?restart the process,NIL,NIL,NIL,NIL,NIL,NIL,Watch the process?detect a deviation?compare with limit?stop the process?correct the deviation?restart the process,NIL,NIL
